<?xml version="1.0" encoding="ISO-8859-1"?>
<!DOCTYPE DDDB SYSTEM "../../../DTD/structure.dtd">
<DDDB>

  <condition name = "Hardware">
    <param name = "AdcMax"        type = "int"    >  4095 </param>
    <param name = "CodingBit"     type = "int"    >     5 </param>
    <param name = "centralHoleX"  type = "int"    >     2 </param>
    <param name = "centralHoleY"  type = "int"    >     2 </param>
  </condition>
  <condition name = "CellsToCards">
    <paramVector name = "cards" type = "int">

<!---   #  a  cf  rf  cl  rl   cr sl -->
        <!---  Outer area -->

        0  0   0   1   7   4   22  2
        1  0   0   5   7   8   22  3
        2  0   0   9   7  12   22  4
        3  0   0  13   7  16   22  5
        4  0   0  17   7  20   22  6
        5  0   0  21   7  24   22  7
        6  0   0  25   7  28   22  8
        7  0   8   1  15   4   22  9
        8  0   8   5  15   8   22 10
        9  0   8  21  15  24   22 11
       10  0   8  25  15  28   22 12

       11  1   0   2   7   5   23  1
       12  1   0   6   7   9   23  2
       13  1   0  10   7  13   23  3
       14  1   0  14   7  17   23  4
       15  1   0  18   7  21   23  5
       16  1   0  22   7  25   23  6
       17  1   0  26   7  29   23  7
       18  1   8   2  15   5   23  8
       19  1   8   6  15   9   23  9
       20  1   8  10  15  13   23 10
       21  1   8  14  15  17   23 11
       22  1   8  18  15  21   23 12
       23  1   8  22  15  25   23 13
       24  1   8  26  15  29   23 14

       25  1  16   2  23   5   24  1
       26  1  16   6  23   9   24  2
       27  1  16  10  23  13   24  3
       28  1  16  14  23  17   24  4
       29  1  16  18  23  21   24  5
       30  1  16  22  23  25   24  6
       31  1  16  26  23  29   24  7
       32  1  24   2  31   5   24  8
       33  1  24   6  31   9   24  9
       34  1  24  10  31  13   24 10
       35  1  24  14  31  17   24 11
       36  1  24  18  31  21   24 12
       37  1  24  22  31  25   24 13
       38  1  24  26  31  29   24 14

       39  0  16   1  23   4   25  2
       40  0  16   5  23   8   25  3
       41  0  16  21  23  24   25  4
       42  0  16  25  23  28   25  5
       43  0  24   1  31   4   25  6 
       44  0  24   5  31   8   25  7
       45  0  24   9  31  12   25  8
       46  0  24  13  31  16   25  9
       47  0  24  17  31  20   25 10
       48  0  24  21  31  24   25 11
       49  0  24  25  31  28   25 12

    </paramVector>
    <paramVector name = "Tell1" type = "int">

        0  6    0   1   2   3   4   5
        1  5    6   7   8   9  10
        2  7   11  12  13  14  15  16  17
        3  7   18  19  20  21  22  23  24 
        4  7   25  26  27  28  29  30  31 
        5  7   32  33  34  35  36  37  38 
        6  6   39  40  41  42  43  44
        7  5   45  46  47  48  49

    </paramVector>
  </condition>

</DDDB>
