<?xml version="1.0" encoding="ISO-8859-1"?>
<!DOCTYPE DDDB SYSTEM "structure.dtd">
<DDDB>
	<catalog name="Alignment">
		<catalog name="Velo">
			<condition name="VeloLeft" classID="1008106">
				<paramVector name="dPosXYZ" type="double">0 0 0</paramVector>
				<paramVector name="dRotXYZ" type="double">0 0 0</paramVector>
				<paramVector name="pivotXYZ" type="double">0 0 0</paramVector>
				<param name="XOffset" type="string">Conditions/Online/Velo/MotionSystem[ResolPosLA]</param>
				<param name="YOffset" type="string">Conditions/Online/Velo/MotionSystem[ResolPosY]</param>
			</condition>
			<condition name="VeloRight" classID="1008106">
				<paramVector name="dPosXYZ" type="double">0 0 0</paramVector>
				<paramVector name="dRotXYZ" type="double">0 0 0</paramVector>
				<paramVector name="pivotXYZ" type="double">0 0 0</paramVector>
				<param name="XOffset" type="string">Conditions/Online/Velo/MotionSystem[ResolPosRC]</param>
				<param name="YOffset" type="string">Conditions/Online/Velo/MotionSystem[ResolPosY]</param>
				<!-- Being YOffset == 1, we should get 15  -->
				<paramVector name="YOffsetCoeffs" type="double">20 -5</paramVector>
			</condition>
		</catalog>
	</catalog>
</DDDB>
