<?xml version="1.0" encoding="ISO-8859-1"?>
<!DOCTYPE DDDB SYSTEM "../../DTD/structure.dtd">
<DDDB>
  <catalog name ="Velo">
    <conditionref href="Alignment/Global.xml#VeloSystem"/>
    <conditionref href="Alignment/Global.xml#VeloRight"/>
    <conditionref href="Alignment/Global.xml#VeloLeft"/>

    <conditionref href="Alignment/Modules.xml#ModulePU00"/>
    <conditionref href="Alignment/Modules.xml#ModulePU01"/>
    <conditionref href="Alignment/Modules.xml#ModulePU02"/>
    <conditionref href="Alignment/Modules.xml#ModulePU03"/>
    <conditionref href="Alignment/Modules.xml#Module00"/>
    <conditionref href="Alignment/Modules.xml#Module01"/>
    <conditionref href="Alignment/Modules.xml#Module02"/>
    <conditionref href="Alignment/Modules.xml#Module03"/>
    <conditionref href="Alignment/Modules.xml#Module04"/>
    <conditionref href="Alignment/Modules.xml#Module05"/>
    <conditionref href="Alignment/Modules.xml#Module06"/>
    <conditionref href="Alignment/Modules.xml#Module07"/>
    <conditionref href="Alignment/Modules.xml#Module08"/>
    <conditionref href="Alignment/Modules.xml#Module09"/>
    <conditionref href="Alignment/Modules.xml#Module10"/>
    <conditionref href="Alignment/Modules.xml#Module11"/>
    <conditionref href="Alignment/Modules.xml#Module12"/>
    <conditionref href="Alignment/Modules.xml#Module13"/>
    <conditionref href="Alignment/Modules.xml#Module14"/>
    <conditionref href="Alignment/Modules.xml#Module15"/>
    <conditionref href="Alignment/Modules.xml#Module16"/>
    <conditionref href="Alignment/Modules.xml#Module17"/>
    <conditionref href="Alignment/Modules.xml#Module18"/>
    <conditionref href="Alignment/Modules.xml#Module19"/>
    <conditionref href="Alignment/Modules.xml#Module20"/>
    <conditionref href="Alignment/Modules.xml#Module21"/>
    <conditionref href="Alignment/Modules.xml#Module22"/>
    <conditionref href="Alignment/Modules.xml#Module23"/>
    <conditionref href="Alignment/Modules.xml#Module24"/>
    <conditionref href="Alignment/Modules.xml#Module25"/>
    <conditionref href="Alignment/Modules.xml#Module26"/>
    <conditionref href="Alignment/Modules.xml#Module27"/>
    <conditionref href="Alignment/Modules.xml#Module28"/>
    <conditionref href="Alignment/Modules.xml#Module29"/>
    <conditionref href="Alignment/Modules.xml#Module30"/>
    <conditionref href="Alignment/Modules.xml#Module31"/>
    <conditionref href="Alignment/Modules.xml#Module32"/>
    <conditionref href="Alignment/Modules.xml#Module33"/>
    <conditionref href="Alignment/Modules.xml#Module34"/>
    <conditionref href="Alignment/Modules.xml#Module35"/>
    <conditionref href="Alignment/Modules.xml#Module36"/>
    <conditionref href="Alignment/Modules.xml#Module37"/>
    <conditionref href="Alignment/Modules.xml#Module38"/>
    <conditionref href="Alignment/Modules.xml#Module39"/>
    <conditionref href="Alignment/Modules.xml#Module40"/>
    <conditionref href="Alignment/Modules.xml#Module41"/>
    
    <conditionref href="Alignment/Detectors.xml#DetectorPU00-00"/>
    <conditionref href="Alignment/Detectors.xml#DetectorPU01-00"/>
    <conditionref href="Alignment/Detectors.xml#DetectorPU02-00"/>
    <conditionref href="Alignment/Detectors.xml#DetectorPU03-00"/>
    <conditionref href="Alignment/Detectors.xml#Detector00-00"/>
    <conditionref href="Alignment/Detectors.xml#Detector00-01"/>
    <conditionref href="Alignment/Detectors.xml#Detector01-00"/>
    <conditionref href="Alignment/Detectors.xml#Detector01-01"/>
    <conditionref href="Alignment/Detectors.xml#Detector02-00"/>
    <conditionref href="Alignment/Detectors.xml#Detector02-01"/>
    <conditionref href="Alignment/Detectors.xml#Detector03-00"/>
    <conditionref href="Alignment/Detectors.xml#Detector03-01"/>
    <conditionref href="Alignment/Detectors.xml#Detector04-00"/>
    <conditionref href="Alignment/Detectors.xml#Detector04-01"/>
    <conditionref href="Alignment/Detectors.xml#Detector05-00"/>
    <conditionref href="Alignment/Detectors.xml#Detector05-01"/>
    <conditionref href="Alignment/Detectors.xml#Detector06-00"/>
    <conditionref href="Alignment/Detectors.xml#Detector06-01"/>
    <conditionref href="Alignment/Detectors.xml#Detector07-00"/>
    <conditionref href="Alignment/Detectors.xml#Detector07-01"/>
    <conditionref href="Alignment/Detectors.xml#Detector08-00"/>
    <conditionref href="Alignment/Detectors.xml#Detector08-01"/>
    <conditionref href="Alignment/Detectors.xml#Detector09-00"/>
    <conditionref href="Alignment/Detectors.xml#Detector09-01"/>
    <conditionref href="Alignment/Detectors.xml#Detector10-00"/>
    <conditionref href="Alignment/Detectors.xml#Detector10-01"/>
    <conditionref href="Alignment/Detectors.xml#Detector11-00"/>
    <conditionref href="Alignment/Detectors.xml#Detector11-01"/>
    <conditionref href="Alignment/Detectors.xml#Detector12-00"/>
    <conditionref href="Alignment/Detectors.xml#Detector12-01"/>
    <conditionref href="Alignment/Detectors.xml#Detector13-00"/>
    <conditionref href="Alignment/Detectors.xml#Detector13-01"/>
    <conditionref href="Alignment/Detectors.xml#Detector14-00"/>
    <conditionref href="Alignment/Detectors.xml#Detector14-01"/>
    <conditionref href="Alignment/Detectors.xml#Detector15-00"/>
    <conditionref href="Alignment/Detectors.xml#Detector15-01"/>
    <conditionref href="Alignment/Detectors.xml#Detector16-00"/>
    <conditionref href="Alignment/Detectors.xml#Detector16-01"/>
    <conditionref href="Alignment/Detectors.xml#Detector17-00"/>
    <conditionref href="Alignment/Detectors.xml#Detector17-01"/>
    <conditionref href="Alignment/Detectors.xml#Detector18-00"/>
    <conditionref href="Alignment/Detectors.xml#Detector18-01"/>
    <conditionref href="Alignment/Detectors.xml#Detector19-00"/>
    <conditionref href="Alignment/Detectors.xml#Detector19-01"/>
    <conditionref href="Alignment/Detectors.xml#Detector20-00"/>
    <conditionref href="Alignment/Detectors.xml#Detector20-01"/>
    <conditionref href="Alignment/Detectors.xml#Detector21-00"/>
    <conditionref href="Alignment/Detectors.xml#Detector21-01"/>
    <conditionref href="Alignment/Detectors.xml#Detector22-00"/>
    <conditionref href="Alignment/Detectors.xml#Detector22-01"/>
    <conditionref href="Alignment/Detectors.xml#Detector23-00"/>
    <conditionref href="Alignment/Detectors.xml#Detector23-01"/>
    <conditionref href="Alignment/Detectors.xml#Detector24-00"/>
    <conditionref href="Alignment/Detectors.xml#Detector24-01"/>
    <conditionref href="Alignment/Detectors.xml#Detector25-00"/>
    <conditionref href="Alignment/Detectors.xml#Detector25-01"/>
    <conditionref href="Alignment/Detectors.xml#Detector26-00"/>
    <conditionref href="Alignment/Detectors.xml#Detector26-01"/>
    <conditionref href="Alignment/Detectors.xml#Detector27-00"/>
    <conditionref href="Alignment/Detectors.xml#Detector27-01"/>
    <conditionref href="Alignment/Detectors.xml#Detector28-00"/>
    <conditionref href="Alignment/Detectors.xml#Detector28-01"/>
    <conditionref href="Alignment/Detectors.xml#Detector29-00"/>
    <conditionref href="Alignment/Detectors.xml#Detector29-01"/>
    <conditionref href="Alignment/Detectors.xml#Detector30-00"/>
    <conditionref href="Alignment/Detectors.xml#Detector30-01"/>
    <conditionref href="Alignment/Detectors.xml#Detector31-00"/>
    <conditionref href="Alignment/Detectors.xml#Detector31-01"/>
    <conditionref href="Alignment/Detectors.xml#Detector32-00"/>
    <conditionref href="Alignment/Detectors.xml#Detector32-01"/>
    <conditionref href="Alignment/Detectors.xml#Detector33-00"/>
    <conditionref href="Alignment/Detectors.xml#Detector33-01"/>
    <conditionref href="Alignment/Detectors.xml#Detector34-00"/>
    <conditionref href="Alignment/Detectors.xml#Detector34-01"/>
    <conditionref href="Alignment/Detectors.xml#Detector35-00"/>
    <conditionref href="Alignment/Detectors.xml#Detector35-01"/>
    <conditionref href="Alignment/Detectors.xml#Detector36-00"/>
    <conditionref href="Alignment/Detectors.xml#Detector36-01"/>
    <conditionref href="Alignment/Detectors.xml#Detector37-00"/>
    <conditionref href="Alignment/Detectors.xml#Detector37-01"/>
    <conditionref href="Alignment/Detectors.xml#Detector38-00"/>
    <conditionref href="Alignment/Detectors.xml#Detector38-01"/>
    <conditionref href="Alignment/Detectors.xml#Detector39-00"/>
    <conditionref href="Alignment/Detectors.xml#Detector39-01"/>
    <conditionref href="Alignment/Detectors.xml#Detector40-00"/>
    <conditionref href="Alignment/Detectors.xml#Detector40-01"/>
    <conditionref href="Alignment/Detectors.xml#Detector41-00"/>
    <conditionref href="Alignment/Detectors.xml#Detector41-01"/>
  </catalog>
</DDDB>
