<?xml version="1.0" encoding="ISO-8859-1"?>
<!--
    (c) Copyright 2000-2018 CERN for the benefit of the LHCb Collaboration

    This software is distributed under the terms of the GNU General Public
    Licence version 3 (GPL Version 3), copied verbatim in the file "COPYING".

    In applying this licence, CERN does not waive the privileges and immunities
    granted to it by virtue of its status as an Intergovernmental Organization
    or submit itself to any jurisdiction.
-->
<!DOCTYPE DDDB SYSTEM "../../../DTD/structure.dtd" >
<DDDB>

  <condition classID="6" name="VeloSystem">
    <paramVector name="dPosXYZ" type="double">0 0 0</paramVector>
    <paramVector name="dRotXYZ" type="double">0 0 0</paramVector>
  </condition>

  <condition classID="6" name="VeloRight">
    <paramVector name="dPosXYZ" type="double">0 0 0</paramVector>
    <paramVector name="dRotXYZ" type="double">0 0 0</paramVector>
    <paramVector name="pivotXYZ" type="double">0 0 0</paramVector>
  </condition>

  <condition classID="6" name="VeloLeft">
    <paramVector name="dPosXYZ" type="double">0 0 0</paramVector>
    <paramVector name="dRotXYZ" type="double">0 0 0</paramVector>
    <paramVector name="pivotXYZ" type="double">0 0 0</paramVector>
  </condition>

</DDDB>
